{
  "codec": "json",
  "expected_error_codes": [],
  "expected_events": [
    {
      "aux": 0,
      "entity_id": 0,
      "kind": "UserTrace",
      "seq": 0,
      "time_ns": 150000000
    },
    {
      "aux": 0,
      "entity_id": 0,
      "kind": "UserTrace",
      "seq": 1,
      "time_ns": 400000000
    }
  ],
  "expected_final_snapshot": {
    "quiescent": true,
    "steps_total": 0,
    "trace_fingerprint": 15252364071715165164
  },
  "fixture_schema_version": "1.0.0",
  "input": {
    "ops": [
      {
        "args": {
          "max_steps": 300000,
          "scenario_id": "host-crash-restart",
          "seed": 8675309,
          "worker_count": 3
        },
        "id": 0,
        "op": "run_scenario"
      }
    ]
  },
  "profile": "lab",
  "provenance": {
    "capture_run_id": "49c16ef3-9d5f-4b9f-873f-162f575c9b91",
    "cargo_lock_sha256": "ddf46a437b62698175bdc96183436813a4a81c220a55ed94c7eb766fe4f20ac9",
    "rust_baseline_commit": "a9e737d869c04c2f6aa4222fe38be66b28628227",
    "rust_toolchain_commit_hash": "3b1b0ef4d80d3117924d91352c8b6ca528708b3c",
    "rust_toolchain_host": "x86_64-unknown-linux-gnu",
    "rust_toolchain_release": "1.96.0-nightly"
  },
  "scenario_dsl_version": "1",
  "scenario_id": "host-crash-restart",
  "seed": 8675309,
  "semantic_digest": "sha256:c2ce4e4ec16b86504962085327ebfac6af788bfba89e22aea0e3c7ac83bcc148"
}