{
  "codec": "bin",
  "expected_error_codes": [],
  "expected_events": [
    {
      "aux": 0,
      "entity_id": 0,
      "kind": "UserTrace",
      "seq": 0,
      "time_ns": 0
    },
    {
      "aux": 0,
      "entity_id": 0,
      "kind": "UserTrace",
      "seq": 1,
      "time_ns": 0
    },
    {
      "aux": 0,
      "entity_id": 0,
      "kind": "UserTrace",
      "seq": 2,
      "time_ns": 0
    },
    {
      "aux": 0,
      "entity_id": 0,
      "kind": "UserTrace",
      "seq": 3,
      "time_ns": 0
    }
  ],
  "expected_final_snapshot": {
    "obligations": 0,
    "regions": 0,
    "tasks": 0
  },
  "fixture_schema_version": "fixture-v1",
  "input": {
    "ops": [
      {
        "args": {
          "capacity": 4
        },
        "id": 0,
        "op": "channel_create"
      },
      {
        "args": {
          "channel_ref": 0
        },
        "id": 1,
        "op": "channel_reserve"
      },
      {
        "args": {
          "payload": "msg1",
          "reservation_ref": 1
        },
        "id": 2,
        "op": "channel_send"
      },
      {
        "args": {
          "channel_ref": 0
        },
        "id": 3,
        "op": "channel_recv"
      }
    ]
  },
  "profile": "ASX_PROFILE_CORE",
  "provenance": {
    "capture_run_id": "a291364d-adbf-4a2d-acf5-a71e66cd969d",
    "cargo_lock_sha256": "ddf46a437b62698175bdc96183436813a4a81c220a55ed94c7eb766fe4f20ac9",
    "rust_baseline_commit": "a9e737d869c04c2f6aa4222fe38be66b28628227",
    "rust_toolchain_commit_hash": "3b1b0ef4d80d3117924d91352c8b6ca528708b3c",
    "rust_toolchain_host": "x86_64-unknown-linux-gnu",
    "rust_toolchain_release": "1.96.0-nightly"
  },
  "scenario_dsl_version": "dsl-v1",
  "scenario_id": "channel-two-phase-send-recv-001",
  "seed": 42,
  "semantic_digest": "sha256:e991ca473c4d513491beec3cb4edfaf520ad60f23fa85a855c6bd638bc75f85f"
}