{
  "codec": "json",
  "expected_error_codes": [
    "1 tasks leaked",
    "refinement_firewall:RFW-REGION-004",
    "refinement_firewall:minimal_counterexample_prefix_len=3"
  ],
  "expected_events": [
    {
      "aux": 0,
      "entity_id": 0,
      "kind": "RegionCreated",
      "seq": 0,
      "time_ns": 0
    },
    {
      "aux": 0,
      "entity_id": 0,
      "kind": "Spawn",
      "seq": 1,
      "time_ns": 0
    },
    {
      "aux": 0,
      "entity_id": 0,
      "kind": "RegionCloseComplete",
      "seq": 2,
      "time_ns": 0
    }
  ],
  "expected_final_snapshot": {
    "obligations": 0,
    "regions": 0,
    "tasks": 1
  },
  "fixture_schema_version": "fixture-v1",
  "input": {
    "ops": [
      {
        "args": {},
        "id": 0,
        "op": "region_open"
      },
      {
        "args": {
          "poll_fn": "complete_immediately",
          "region_ref": 0
        },
        "id": 1,
        "op": "task_spawn"
      },
      {
        "args": {
          "budget_polls": 5,
          "region_ref": 0
        },
        "id": 2,
        "op": "scheduler_run"
      },
      {
        "args": {
          "region_ref": 0
        },
        "id": 3,
        "op": "region_close"
      }
    ]
  },
  "profile": "ASX_PROFILE_FREESTANDING",
  "provenance": {
    "capture_run_id": "8ea87aa8-f4c9-49d6-86b6-ebdd07f0ab89",
    "cargo_lock_sha256": "ddf46a437b62698175bdc96183436813a4a81c220a55ed94c7eb766fe4f20ac9",
    "rust_baseline_commit": "a9e737d869c04c2f6aa4222fe38be66b28628227",
    "rust_toolchain_commit_hash": "3b1b0ef4d80d3117924d91352c8b6ca528708b3c",
    "rust_toolchain_host": "x86_64-unknown-linux-gnu",
    "rust_toolchain_release": "1.96.0-nightly"
  },
  "scenario_dsl_version": "dsl-v1",
  "scenario_id": "task-lifecycle-spawn-complete-003",
  "seed": 42,
  "semantic_digest": "sha256:37065342b71247acf4099aa1a1d8c4e6c9621dc5d1e50b0fd20f48d78b0b6b09"
}