{
  "codec": "bin",
  "expected_error_codes": [],
  "expected_events": [],
  "expected_final_snapshot": {
    "obligations": 0,
    "regions": 0,
    "tasks": 0
  },
  "fixture_schema_version": "fixture-v1",
  "input": {
    "ops": [
      {
        "args": {},
        "id": 0,
        "op": "noop"
      }
    ]
  },
  "profile": "ASX_PROFILE_FREESTANDING",
  "provenance": {
    "capture_run_id": "9fad89b2-b4d1-4f4a-85a1-011eb49ebc99",
    "cargo_lock_sha256": "ddf46a437b62698175bdc96183436813a4a81c220a55ed94c7eb766fe4f20ac9",
    "rust_baseline_commit": "a9e737d869c04c2f6aa4222fe38be66b28628227",
    "rust_toolchain_commit_hash": "3b1b0ef4d80d3117924d91352c8b6ca528708b3c",
    "rust_toolchain_host": "x86_64-unknown-linux-gnu",
    "rust_toolchain_release": "1.96.0-nightly"
  },
  "scenario_dsl_version": "dsl-v1",
  "scenario_id": "smoke.profile_parity.baseline",
  "seed": 42,
  "semantic_digest": "sha256:a0108c97c4d453acaa0f914b3eb1622fdf1494e6d7ed7f04c09dba8fb99240b4"
}