{
  "codec": "bin",
  "expected_error_codes": [
    "1 tasks leaked",
    "refinement_firewall:RFW-QUIESCE-001",
    "refinement_firewall:minimal_counterexample_prefix_len=6"
  ],
  "expected_events": [
    {
      "aux": 0,
      "entity_id": 0,
      "kind": "RegionCreated",
      "seq": 0,
      "time_ns": 0
    },
    {
      "aux": 0,
      "entity_id": 0,
      "kind": "Spawn",
      "seq": 1,
      "time_ns": 0
    },
    {
      "aux": 0,
      "entity_id": 0,
      "kind": "RegionCancelled",
      "seq": 2,
      "time_ns": 0
    },
    {
      "aux": 0,
      "entity_id": 0,
      "kind": "RegionCloseBegin",
      "seq": 3,
      "time_ns": 0
    },
    {
      "aux": 0,
      "entity_id": 0,
      "kind": "RegionCancelled",
      "seq": 4,
      "time_ns": 0
    },
    {
      "aux": 0,
      "entity_id": 0,
      "kind": "RegionCloseComplete",
      "seq": 5,
      "time_ns": 0
    }
  ],
  "expected_final_snapshot": {
    "obligations": 0,
    "regions": 0,
    "tasks": 1
  },
  "fixture_schema_version": "fixture-v1",
  "input": {
    "ops": [
      {
        "args": {},
        "id": 0,
        "op": "region_open"
      },
      {
        "args": {
          "poll_fn": "yield_forever",
          "region_ref": 0
        },
        "id": 1,
        "op": "task_spawn"
      },
      {
        "args": {
          "kind": "USER",
          "severity": 0,
          "task_ref": 1
        },
        "id": 2,
        "op": "task_cancel"
      },
      {
        "args": {
          "kind": "SHUTDOWN",
          "severity": 5,
          "task_ref": 1
        },
        "id": 3,
        "op": "task_cancel"
      },
      {
        "args": {
          "budget_polls": 5,
          "region_ref": 0
        },
        "id": 4,
        "op": "scheduler_run"
      },
      {
        "args": {
          "region_ref": 0
        },
        "id": 5,
        "op": "region_close"
      }
    ]
  },
  "profile": "ASX_PROFILE_CORE",
  "provenance": {
    "capture_run_id": "3a2efd02-1ae2-4f82-a1d3-2e2115452bd8",
    "cargo_lock_sha256": "ddf46a437b62698175bdc96183436813a4a81c220a55ed94c7eb766fe4f20ac9",
    "rust_baseline_commit": "a9e737d869c04c2f6aa4222fe38be66b28628227",
    "rust_toolchain_commit_hash": "3b1b0ef4d80d3117924d91352c8b6ca528708b3c",
    "rust_toolchain_host": "x86_64-unknown-linux-gnu",
    "rust_toolchain_release": "1.96.0-nightly"
  },
  "scenario_dsl_version": "dsl-v1",
  "scenario_id": "cancel-severity-strengthen-002",
  "seed": 42,
  "semantic_digest": "sha256:b8f440a52bc91e0164f2103e39483a0398e9318c44581a4a3fede8225da2de0a"
}