{
  "codec": "json",
  "expected_error_codes": [
    "1 tasks leaked",
    "refinement_firewall:RFW-REGION-004",
    "refinement_firewall:minimal_counterexample_prefix_len=5"
  ],
  "expected_events": [
    {
      "aux": 0,
      "entity_id": 0,
      "kind": "RegionCreated",
      "seq": 0,
      "time_ns": 0
    },
    {
      "aux": 0,
      "entity_id": 0,
      "kind": "Spawn",
      "seq": 1,
      "time_ns": 0
    },
    {
      "aux": 0,
      "entity_id": 0,
      "kind": "ObligationReserve",
      "seq": 2,
      "time_ns": 0
    },
    {
      "aux": 0,
      "entity_id": 0,
      "kind": "ObligationAbort",
      "seq": 3,
      "time_ns": 0
    },
    {
      "aux": 0,
      "entity_id": 0,
      "kind": "RegionCloseComplete",
      "seq": 4,
      "time_ns": 0
    }
  ],
  "expected_final_snapshot": {
    "obligations": 0,
    "regions": 0,
    "tasks": 1
  },
  "fixture_schema_version": "fixture-v1",
  "input": {
    "ops": [
      {
        "args": {},
        "id": 0,
        "op": "region_open"
      },
      {
        "args": {
          "region_ref": 0
        },
        "id": 1,
        "op": "obligation_reserve"
      },
      {
        "args": {
          "obligation_ref": 1
        },
        "id": 2,
        "op": "obligation_abort"
      },
      {
        "args": {
          "region_ref": 0
        },
        "id": 3,
        "op": "region_close"
      }
    ]
  },
  "profile": "ASX_PROFILE_FREESTANDING",
  "provenance": {
    "capture_run_id": "8a1e5e1a-63c3-4dcc-9221-66fd92c21e17",
    "cargo_lock_sha256": "ddf46a437b62698175bdc96183436813a4a81c220a55ed94c7eb766fe4f20ac9",
    "rust_baseline_commit": "a9e737d869c04c2f6aa4222fe38be66b28628227",
    "rust_toolchain_commit_hash": "3b1b0ef4d80d3117924d91352c8b6ca528708b3c",
    "rust_toolchain_host": "x86_64-unknown-linux-gnu",
    "rust_toolchain_release": "1.96.0-nightly"
  },
  "scenario_dsl_version": "dsl-v1",
  "scenario_id": "obligation-lifecycle-reserve-abort-005",
  "seed": 42,
  "semantic_digest": "sha256:9db6241fb00e1e3c322f9d5b59d213dff0ee5e10acc94ef8f9e776470944641d"
}