{
  "codec": "json",
  "expected_error_codes": [],
  "expected_events": [],
  "expected_final_snapshot": {
    "quiescent": true,
    "steps_total": 0,
    "trace_fingerprint": 1018490530646331224
  },
  "fixture_schema_version": "1.0.0",
  "input": {
    "ops": [
      {
        "args": {
          "max_steps": 100000,
          "scenario_id": "chaos-sendpermit-ack",
          "seed": 7,
          "worker_count": 2
        },
        "id": 0,
        "op": "run_scenario"
      }
    ]
  },
  "profile": "lab",
  "provenance": {
    "capture_run_id": "42404f23-d3f5-43f6-9c48-3af2f9d48e90",
    "cargo_lock_sha256": "ddf46a437b62698175bdc96183436813a4a81c220a55ed94c7eb766fe4f20ac9",
    "rust_baseline_commit": "a9e737d869c04c2f6aa4222fe38be66b28628227",
    "rust_toolchain_commit_hash": "3b1b0ef4d80d3117924d91352c8b6ca528708b3c",
    "rust_toolchain_host": "x86_64-unknown-linux-gnu",
    "rust_toolchain_release": "1.96.0-nightly"
  },
  "scenario_dsl_version": "1",
  "scenario_id": "chaos-sendpermit-ack",
  "seed": 7,
  "semantic_digest": "sha256:aaeec21a1c03c7453475ee4085f31de9d03b421bca63478d5d522277812aaba1"
}